{
  "$schema": "https://json-schema.org/draft/2020-12/schema",
  "$id": "https://vulcano.ai/schemas/daily-index.v1.json",
  "title": "Daily Index v1",
  "type": "object",
  "required": ["date", "count", "topics", "countries", "generated_at"],
  "properties": {
    "version": { "type": "string", "default": "v1.0" },
    "date": { "type": "string", "pattern": "^\\d{4}-\\d{2}-\\d{2}$" },
    "count": { "type": "integer", "minimum": 0 },
    "topics": {
      "type": "object",
      "additionalProperties": { "type": "integer", "minimum": 0 }
    },
    "countries": {
      "type": "object",
      "additionalProperties": { "type": "integer", "minimum": 0 }
    },
    "generated_at": { "type": "string", "format": "date-time" }
  },
  "additionalProperties": true
}

