{
  "date": "2025-09-14",
  "count": 53,
  "topics": {
    "Regulación": 29,
    "Tecnología": 22,
    "Startups": 19,
    "Fintech": 7,
    "Criptomonedas": 5,
    "Energía": 4,
    "Sostenibilidad": 3,
    "Inteligencia Artificial": 3,
    "Economía": 2,
    "Inversión": 2,
    "Innovación": 2,
    "Educación": 2,
    "Financiamiento": 2,
    "Ciberseguridad": 2,
    "Inflación": 1,
    "Agricultura": 1,
    "Inversiones": 1,
    "Finanzas": 1,
    "Gobierno": 1,
    "Datos": 1,
    "Logística": 1,
    "Edtech": 1,
    "IA": 1,
    "Movilidad": 1,
    "Salud Digital": 1,
    "E-commerce": 1
  },
  "countries": {
    "México": 13,
    "Colombia": 11,
    "Brasil": 11,
    "Argentina": 5,
    "Chile": 5,
    "Perú": 4,
    "Regional": 2,
    "Uruguay": 1,
    "Paraguay": 1
  },
  "generated_at": "2025-09-14T17:01:19.822Z"
}