{
  "date": "2025-09-13",
  "count": 112,
  "topics": {
    "Regulación": 48,
    "Tecnología": 41,
    "Startups": 36,
    "Fintech": 12,
    "Ciberseguridad": 12,
    "Sostenibilidad": 8,
    "Educación": 8,
    "Criptomonedas": 7,
    "Inversión": 5,
    "Edtech": 5,
    "Innovación": 5,
    "Inteligencia Artificial": 5,
    "Privacidad": 4,
    "Energía": 4,
    "Pymes": 4,
    "PYMES": 2,
    "Gobierno": 2,
    "Movilidad": 2,
    "Gobierno Digital": 2,
    "Infraestructura": 2,
    "Tecnología Verde": 2,
    "Economía": 2,
    "AgroTech": 2,
    "Salud Digital": 2,
    "Logística": 2,
    "Datos": 1,
    "Finanzas": 1,
    "Streaming": 1,
    "Inclusión Digital": 1,
    "Agritech": 1,
    "Comercio Electrónico": 1,
    "Blockchain": 1,
    "Movilidad Eléctrica": 1,
    "Entretenimiento": 1,
    "Movilidad Sostenible": 1,
    "EdTech": 1,
    "Capacitación": 1,
    "Healthtech": 1,
    "E-commerce": 1,
    "IA": 1
  },
  "countries": {
    "México": 15,
    "Colombia": 15,
    "Brasil": 15,
    "Argentina": 11,
    "Chile": 11,
    "Perú": 9,
    "Bolivia": 4,
    "Panamá": 4,
    "Regional": 4,
    "Honduras": 3,
    "Guatemala": 3,
    "República Dominicana": 3,
    "Paraguay": 3,
    "Costa Rica": 3,
    "Ecuador": 3,
    "El Salvador": 2,
    "Uruguay": 2,
    "Venezuela": 2
  },
  "generated_at": "2025-09-13T19:09:11.687Z"
}